{
  "retailer": "ammodeport",
  "retailer_slug": "ammunition-depot",
  "platform": "magento",
  "base": "https://www.ammunitiondepot.com",
  "comment": "Expansion #4 Step-2 fan-out, shape A (dict->str). Transcribed verbatim from scraper_ammodeport.py inline CALIBER_PATHS on 2026-06-14, parity-proven byte-identical before flip. Each inline value carried its sort/paging suffix inline (?sort=price-asc&limit=96); stored here split into path + query so the redirect guard can ignore the query. Not yet harness-validated; validation null until Step-3. Approved by Jon, Step-2 fan-out, 2026-06-14.",
  "discovery": {
    "method": "manual"
  },
  "calibers": {
    "9mm": [
      {
        "path": "/ammo/9mm/",
        "query": "sort=price-asc&limit=96",
        "status": "active"
      }
    ],
    "380acp": [
      {
        "path": "/ammo/380-auto/",
        "query": "sort=price-asc&limit=96",
        "status": "active"
      }
    ],
    "40sw": [
      {
        "path": "/ammo/40-s-w/",
        "query": "sort=price-asc&limit=96",
        "status": "active"
      }
    ],
    "38spl": [
      {
        "path": "/ammo/38-special/",
        "query": "sort=price-asc&limit=96",
        "status": "active"
      }
    ],
    "357mag": [
      {
        "path": "/ammo/357-magnum/",
        "query": "sort=price-asc&limit=96",
        "status": "active"
      }
    ],
    "22lr": [
      {
        "path": "/ammo/22-lr/",
        "query": "sort=price-asc&limit=96",
        "status": "active"
      }
    ],
    "223-556": [
      {
        "path": "/ammo/223-556/",
        "query": "sort=price-asc&limit=96",
        "status": "active"
      }
    ],
    "308win": [
      {
        "path": "/ammo/308-762x51/",
        "query": "sort=price-asc&limit=96",
        "status": "active"
      }
    ],
    "762x39": [
      {
        "path": "/ammo/762x39/",
        "query": "sort=price-asc&limit=96",
        "status": "active"
      }
    ],
    "300blk": [
      {
        "path": "/ammo/300-blackout/",
        "query": "sort=price-asc&limit=96",
        "status": "active"
      }
    ]
  }
}
